[
  {
    "settlement_record_id":"SYN-SET-T90",
    "case_id":"SYN-001",
    "preregistration_bundle_id":"SYN-PRB-001",
    "schema_version":"1.0.0",
    "horizon":"T90",
    "settled_at":"2026-11-22T00:11:00Z",
    "binary_resolutions":[{"outcome_definition_id":"OUT-FORCE","resolution":"INDETERMINATE","model_brier_scores":{"FULL":null,"ABLATE_PIP":null,"ABLATE_EAA":null,"ABLATE_NLP":null,"BASELINE":null}}],
    "causal_settlements":[
      {"outcome_definition_id":"OUT-PIP","state":"SUPPORTED"},
      {"outcome_definition_id":"OUT-EAA","state":"PARTIALLY_SUPPORTED"},
      {"outcome_definition_id":"OUT-NLP","state":"SUPPORTED"}
    ],
    "new_evidence_refs":["SYN-FUTURE-T90"],
    "authority":{"prediction_mutation_authority":false,"capital_authority":false,"canon_authority":false}
  },
  {
    "settlement_record_id":"SYN-SET-T180",
    "case_id":"SYN-001",
    "preregistration_bundle_id":"SYN-PRB-001",
    "schema_version":"1.0.0",
    "horizon":"T180",
    "settled_at":"2027-02-20T00:11:00Z",
    "binary_resolutions":[{"outcome_definition_id":"OUT-FORCE","resolution":"YES","model_brier_scores":{"FULL":0.0625,"ABLATE_PIP":0.20249999999999996,"ABLATE_EAA":0.16000000000000003,"ABLATE_NLP":0.12249999999999998,"BASELINE":0.25}}],
    "causal_settlements":[
      {"outcome_definition_id":"OUT-PIP","state":"SUPPORTED"},
      {"outcome_definition_id":"OUT-EAA","state":"SUPPORTED"},
      {"outcome_definition_id":"OUT-NLP","state":"PARTIALLY_SUPPORTED"}
    ],
    "new_evidence_refs":["SYN-FUTURE-T180"],
    "authority":{"prediction_mutation_authority":false,"capital_authority":false,"canon_authority":false}
  },
  {
    "settlement_record_id":"SYN-SET-T365",
    "case_id":"SYN-001",
    "preregistration_bundle_id":"SYN-PRB-001",
    "schema_version":"1.0.0",
    "horizon":"T365",
    "settled_at":"2027-08-24T00:11:00Z",
    "binary_resolutions":[{"outcome_definition_id":"OUT-FORCE","resolution":"NO","model_brier_scores":{"FULL":0.5625,"ABLATE_PIP":0.30250000000000005,"ABLATE_EAA":0.36,"ABLATE_NLP":0.42250000000000004,"BASELINE":0.25}}],
    "causal_settlements":[
      {"outcome_definition_id":"OUT-PIP","state":"FALSIFIED"},
      {"outcome_definition_id":"OUT-EAA","state":"FALSIFIED"},
      {"outcome_definition_id":"OUT-NLP","state":"FALSIFIED"}
    ],
    "new_evidence_refs":["SYN-FUTURE-T365"],
    "authority":{"prediction_mutation_authority":false,"capital_authority":false,"canon_authority":false}
  }
]
